### ISSUE TITLE
ARP resolver fails in a specific netlink scenario with IPs on multiple interfaces

### ISSUE THREAD

**Issue by leoluk** [firedancer-io/firedancer#2575]
We have a host where a local gateway IP (`10.193.161.1`) is configured on multiple interfaces, which is uncommon, but perfectly valid in the kernel's weak host model:

```
# ip a l 
1: lo: <LOOPBACK,UP,LOWER_UP> mtu 65536 xdpgeneric/id:49 qdisc noqueue state UNKNOWN group default qlen 1000
    link/loopback 00:00:00:00:00:00 brd 00:00:00:00:00:00
    inet 127.0.0.1/8 scope host lo
       valid_lft forever preferred_lft forever
    inet 169.254.77.53/32 scope link lo
       valid_lft forever preferred_lft forever
    inet 10.193.161.1/32 scope global lo
       valid_lft forever preferred_lft forever
    inet6 ::1/128 scope host proto kernel_lo 
       valid_lft forever preferred_lft forever
2: enp65s0f0: <BROADCAST,MULTICAST,SLAVE,UP,LOWER_UP> mtu 1500 qdisc mq master bond0 state UP group default qlen 1000
    link/ether 40:a6:b7:20:0e:70 brd ff:ff:ff:ff:ff:ff
3: enp65s0f1: <BROADCAST,MULTICAST,SLAVE,UP,LOWER_UP> mtu 1500 qdisc mq master bond0 state UP group default qlen 1000
    link/ether 40:a6:b7:20:0e:70 brd ff:ff:ff:ff:ff:ff permaddr 40:a6:b7:20:0e:71
4: sit0@NONE: <NOARP> mtu 1480 qdisc noop state DOWN group default qlen 1000
    link/sit 0.0.0.0 brd 0.0.0.0
5: clusternet: <POINTOPOINT,NOARP,UP,LOWER_UP> mtu 1420 qdisc noqueue state UNKNOWN group default 
    link/none 
6: bond0: <BROADCAST,MULTICAST,MASTER,UP,LOWER_UP> mtu 1500 xdpgeneric/id:48 qdisc noqueue state UP group default qlen 1000
    link/ether 40:a6:b7:20:0e:70 brd ff:ff:ff:ff:ff:ff
    inet 147.75.205.209/31 scope global bond0
       valid_lft forever preferred_lft forever
    inet 10.12.144.131/31 scope global bond0
       valid_lft forever preferred_lft forever
    inet6 2604:1380:4601:d300::3/127 scope global 
       valid_lft forever preferred_lft forever
    inet6 fe80::42a6:b7ff:fe20:e70/64 scope link proto kernel_ll 
       valid_lft forever preferred_lft forever
7: vethcbb5d0eb@if3: <BROADCAST,MULTICAST,UP,LOWER_UP> mtu 1420 qdisc noqueue state UP group default 
    link/ether 1a:23:53:51:cf:fc brd ff:ff:ff:ff:ff:ff link-netnsid 0
    inet 10.193.161.1/32 scope global vethcbb5d0eb
       valid_lft forever preferred_lft forever
    inet6 fe80::1823:53ff:fe51:cffc/64 scope link proto kernel_ll 
       valid_lft forever preferred_lft forever
8: veth0e11021d@if3: <BROADCAST,MULTICAST,UP,LOWER_UP> mtu 1420 qdisc noqueue state UP group default 
    link/ether f2:79:ad:f8:db:b1 brd ff:ff:ff:ff:ff:ff link-netnsid 1
    inet 10.193.161.1/32 scope global veth0e11021d
       valid_lft forever preferred_lft forever
    inet6 fe80::f079:adff:fef8:dbb1/64 scope link proto kernel_ll 
       valid_lft forever preferred_lft forever
```

```
# ip route list
default via 147.75.205.208 dev bond0 proto static onlink 
10.0.0.0/8 via 10.12.144.130 dev bond0 proto static onlink 
10.12.144.130/31 dev bond0 proto kernel scope link src 10.12.144.131 
10.192.0.0/11 dev clusternet proto 129 
10.193.161.2 dev vethcbb5d0eb scope host 
10.193.161.3 dev veth0e11021d scope host 
147.75.205.208/31 dev bond0 proto kernel scope link src 147.75.205.209 

# ip route show table local 
local 10.12.144.131 dev bond0 proto kernel scope host src 10.12.144.131 
local 10.193.161.1 dev lo proto kernel scope host src 10.193.161.1 
local 10.193.161.1 dev vethcbb5d0eb proto kernel scope host src 10.193.161.1 
local 10.193.161.1 dev veth0e11021d proto kernel scope host src 10.193.161.1 
local 127.0.0.0/8 dev lo proto kernel scope host src 127.0.0.1 
local 127.0.0.1 dev lo proto kernel scope host src 127.0.0.1 
broadcast 127.255.255.255 dev lo proto kernel scope link src 127.0.0.1 
local 147.75.205.209 dev bond0 proto kernel scope host src 147.75.205.209 
local 169.254.77.53 dev lo proto kernel scope host src 169.254.77.53
```

When sending packets to `147.75.205.209`, the kernel will route it to `lo` regardless of interface IPs, and picks `10.193.161.1` as source IP, because of its `scope global` attribute on `lo` (http://linux-ip.net/gl/ip-cref/ip-cref-node174.html):

```
17:13:36.952570 IP 10.193.161.1.46914 > 147.75.205.209.9007: UDP, length 5
17:13:37.728707 IP 10.193.161.1.40569 > 147.75.205.209.9007: UDP, length 5
17:13:38.328959 IP 10.193.161.1.55820 > 147.75.205.209.9007: UDP, length 5
```

Firedancer fails to resolve a destination route for these packets:

> WARNING 08-01 17:06:06.906417 163    1    net:0 src/waltz/ip/fd_netlink.c(975): netlink returned data with error: 1 Operation not permitted adding ip address: 10.193.161.1 on ifindex: 5

(full log: https://gist.github.com/leoluk/5e2aaa4f740ab4498e5140f38bb8ac1f )

We can work around it by making the kernel pick the public IP as src address instead (`ip addr add $(hostname -i)/32 dev lo`), but it seems like a bug in FD.

**Comment by ripatel-fd** [comment]
@leoluk Thanks for the report. Could you please share the commit ref where you saw this at? Is it reproducible on the latest main commit?

**Comment by leoluk** [comment]
Yes, that was on https://github.com/firedancer-io/firedancer/commit/0db931e522e93635f6ab037b22ef5f32b1100841

**Comment by mmcgee-jump** [comment]
Switching ARP implementation in v0.2, so WONTFIX for now

**Comment by ripatel-fd** [comment]
The netlink part is done. Now we just need to switch the loopback XDP program to accept traffic for all dst IPs.
