### ISSUE TITLE
Additional Shred Destination Doesn't Always Work with XDP and Localhost

### ISSUE THREAD

**Issue by temporal-dude** [firedancer-io/firedancer#5651]
When using this config

```
[tiles]
    [tiles.shred]
        additional_shred_destination = "127.0.0.1:18001"
```

Traffic seems to be available on localhost

```
sudo tcpdump -i lo -c 5 port 18001
tcpdump: verbose output suppressed, use -v[v]... for full protocol decode
listening on lo, link-type EN10MB (Ethernet), snapshot length 262144 bytes
20:07:39.399790 IP localhost.8003 > localhost.18001: UDP, length 1203
20:07:39.399812 IP localhost.8003 > localhost.18001: UDP, length 1203
20:07:39.404054 IP localhost.8003 > localhost.18001: UDP, length 1228
20:07:39.404935 IP localhost.8003 > localhost.18001: UDP, length 1228
20:07:39.405172 IP localhost.8003 > localhost.18001: UDP, length 1228
```

But `sudo netcat -l -u -s localhost -p 18001` doesn't pick  it up at all with XDP provider

```
[net]
    provider = "xdp"
```

but netcat will see the traffic with socket provider

```
[net]
    provider = "socket"
```

I'm told nginx streaming works, but I haven't tested, will update with nginx config if I test and it works.

**Comment by ripatel-fd** [comment]
@temporal-dude I figured out the source of the drops. Might be a kernel bug.

https://elixir.bootlin.com/linux/v6.11/source/net/ipv4/route.c#L2255

For now, this works around the problem:

```
sysctl net.ipv4.conf.all.route_localnet=1
```

**Comment by ripatel-fd** [comment]
Clean reproducer

```shell
# Terminal 1
build/native/gcc/bin/firedancer-dev udpecho --port 8080

# Terminal 2
nc -u 127.0.0.1 8080
asdf
```


Some debug info


```
skb:kfree_skb: skbaddr=0xffff9e80282bc800 rx_sk=(nil) protocol=2048 location=ip_rcv_finish_core.constprop.0+0x1d8 reason: NOT_SPECIFIED
```

```
ip_rcv() {
  ip_rcv_core();
  ip_rcv_finish_core.constprop.0() {
    udp_v4_early_demux();
    ip_route_input_noref() {
      __rcu_read_lock();
      ip_route_input_slow();
      __rcu_read_unlock();
    }
    sk_skb_reason_drop() {
      skb_release_head_state() {
        sock_pfree();
      }
      skb_release_data() {
        skb_free_head() {
          kfree();
        }
      }
      kfree_skbmem() {
        kmem_cache_free() {
          __memcg_slab_free_hook();
        }
      }
    }
  }
}
```

```
net:0 1831877 [000] 339213.573956: skb:kfree_skb: skbaddr=0xffff9e80282bc300 rx_sk=(nil) protocol=2048 location=ip_rcv_finish_core.constprop.0+0x1d8 reason: NOT_SPECIFIED
        ffffffffa4148421 sk_skb_reason_drop+0x91 ([kernel.kallsyms])s])
        ffffffffa4148421 sk_skb_reason_drop+0x91 ([kernel.kallsyms])
        ffffffffa42255c8 ip_rcv_finish_core.constprop.0+0x1d8 ([kernel.kallsyms])
        ffffffffa42264b4 ip_rcv+0xa4 ([kernel.kallsyms])ernel.kallsyms])
        ffffffffa4169deb __netif_receive_skb_one_core+0x8b ([kernel.kallsyms])
        ffffffffa416a0ba process_backlog+0x8a ([kernel.kallsyms])
        ffffffffa416ae89 __napi_poll+0x29 ([kernel.kallsyms])l.kallsyms])
        ffffffffa416b651 net_rx_action+0x321 ([kernel.kallsyms])allsyms])
        ffffffffa36f2630 handle_softirqs+0xd0 ([kernel.kallsyms])el.kallsyms])
        ffffffffa36f30b0 do_softirq+0x40 ([kernel.kallsyms])yms])
        ffffffffa36f313a __local_bh_enable_ip+0x5a ([kernel.kallsyms])
        ffffffffa41674a2 __dev_direct_xmit+0x142 ([kernel.kallsyms])
        ffffffffa4391fdb __xsk_generic_xmit+0x33b ([kernel.kallsyms])
        ffffffffa4392160 __xsk_sendmsg.constprop.0.isra.0+0xc0 ([kernel.kallsyms])
        ffffffffa43922a4 xsk_sendmsg+0x24 ([kernel.kallsyms])
        ffffffffa4134a17 __sys_sendto+0x1f7 ([kernel.kallsyms])
        ffffffffa4134a64 __x64_sys_sendto+0x24 ([kernel.kallsyms])
        ffffffffa43eb96d do_syscall_64+0x7d ([kernel.kallsyms])
        ffffffffa460012f entry_SYSCALL_64_after_hwframe+0x76 ([kernel.kallsyms])
            7f134990ffe6 __libc_sendto+0x76 (/usr/lib64/libc.so.6)
            559c651104e8 stem_run+0xe88 (/data/r/firedancer/build/native/gcc/bin/firedancer-dev)
            559c6514aeeb fd_topo_run_tile+0x3eb (/data/r/firedancer/build/native/gcc/bin/firedancer-dev)
            559c6514b315 run_tile_thread_main+0x95 (/data/r/firedancer/build/native/gcc/bin/firedancer-dev)
            7f134988a19a start_thread+0x31a (/usr/lib64/libc.so.6)
```
